{
  "id": "article-1001-v1",
  "entry_id": "article-1001",
  "locale": "en",
  "version": 1,
  "snapshot": {
    "id": "article-1001",
    "locale": "en",
    "kind": "article",
    "status": "published",
    "visibility": "public",
    "slug": "hello-from-codex",
    "title": "Hello from Codex",
    "content": "One entry contract, many adapters.",
    "version": 1,
    "created_at": "2026-09-09T12:00:00Z",
    "updated_at": "2026-09-09T12:00:00Z",
    "published_at": "2026-09-09T12:00:00Z"
  },
  "author_id": "operator-1",
  "reason": "Initial fixture",
  "created_at": "2026-09-09T12:01:00Z"
}
